[
  {
    "id": "ada",
    "title": {
      "th": "เอดา เลิฟเลซ",
      "en": "Ada Lovelace"
    },
    "image": "/assets/placeholders/item-01.svg",
    "field": {
      "th": "ผู้บุกเบิกการเขียนโปรแกรม",
      "en": "Programming pioneer"
    },
    "color": "#66e6ff",
    "description": {
      "th": "นักคณิตศาสตร์ชาวอังกฤษ ผู้เขียนอัลกอริทึมสำหรับเครื่อง Analytical Engine ในปี 1843 จนได้รับการยกย่องว่าเป็นโปรแกรมเมอร์คนแรกของโลก",
      "en": "An English mathematician who wrote an algorithm for the Analytical Engine in 1843 and is often recognized as the first computer programmer."
    },
    "facts": {
      "th": [
        "อัลกอริทึม",
        "Analytical Engine",
        "โปรแกรมเมอร์คนแรก"
      ],
      "en": [
        "Algorithm",
        "Analytical Engine",
        "First programmer"
      ]
    },
    "source": {
      "url": "https://th.wikipedia.org/wiki/เอดา_เลิฟเลซ",
      "language": "th",
      "label": "Wikipedia"
    },
    "imageCredit": "LearnMatch AI template placeholder",
    "imageLicense": "template-generated"
  },
  {
    "id": "hedy",
    "title": {
      "th": "เฮดี ลาเมอร์",
      "en": "Hedy Lamarr"
    },
    "image": "/assets/placeholders/item-02.svg",
    "field": {
      "th": "นักประดิษฐ์ระบบสื่อสาร",
      "en": "Communications inventor"
    },
    "color": "#c989ff",
    "description": {
      "th": "นักแสดงและนักประดิษฐ์ชาวออสเตรีย–อเมริกัน ผู้ร่วมคิดค้นระบบเปลี่ยนความถี่สัญญาณ (Frequency Hopping) ซึ่งเป็นรากฐานสำคัญของ Wi‑Fi, Bluetooth และ GPS",
      "en": "An Austrian-American actor and inventor who co-developed frequency-hopping technology, an important foundation for later wireless communication systems."
    },
    "facts": {
      "th": [
        "Frequency Hopping",
        "Wi‑Fi",
        "Bluetooth"
      ],
      "en": [
        "Frequency Hopping",
        "Wi‑Fi",
        "Bluetooth"
      ]
    },
    "source": {
      "url": "https://th.wikipedia.org/wiki/เฮดี_ลามาร์",
      "language": "th",
      "label": "Wikipedia"
    },
    "imageCredit": "LearnMatch AI template placeholder",
    "imageLicense": "template-generated"
  },
  {
    "id": "katherine",
    "title": {
      "th": "แคเทอรีน จอห์นสัน",
      "en": "Katherine Johnson"
    },
    "image": "/assets/placeholders/item-03.svg",
    "field": {
      "th": "นักคณิตศาสตร์นาซา",
      "en": "NASA mathematician"
    },
    "color": "#ff9d6c",
    "description": {
      "th": "นักคณิตศาสตร์แห่ง NASA ผู้คำนวณวิถีโคจรให้ภารกิจสำคัญของสหรัฐฯ ตั้งแต่เที่ยวบินของจอห์น เกลนน์ ไปจนถึงเส้นทางของ Apollo 11 สู่ดวงจันทร์",
      "en": "A NASA mathematician who calculated flight trajectories for key United States missions, including John Glenn's flight and Apollo 11's journey to the Moon."
    },
    "facts": {
      "th": [
        "NASA",
        "Apollo 11",
        "วิถีโคจร"
      ],
      "en": [
        "NASA",
        "Apollo 11",
        "Orbital trajectories"
      ]
    },
    "source": {
      "url": "https://en.wikipedia.org/wiki/Katherine_Johnson",
      "language": "en",
      "label": "Wikipedia"
    },
    "imageCredit": "LearnMatch AI template placeholder",
    "imageLicense": "template-generated"
  },
  {
    "id": "marie",
    "title": {
      "th": "มารี กูรี",
      "en": "Marie Curie"
    },
    "image": "/assets/placeholders/item-04.svg",
    "field": {
      "th": "ผู้บุกเบิกกัมมันตรังสี",
      "en": "Radioactivity pioneer"
    },
    "color": "#83f3bf",
    "description": {
      "th": "นักวิทยาศาสตร์เชื้อสายโปแลนด์ ผู้ค้นพบธาตุพอโลเนียมและเรเดียม เป็นผู้หญิงคนแรกที่ได้รับรางวัลโนเบล และเป็นบุคคลเดียวที่ได้โนเบล 2 สาขาวิทยาศาสตร์",
      "en": "A Polish-born scientist who discovered polonium and radium, became the first woman to receive a Nobel Prize, and remains the only person to win Nobel Prizes in two scientific fields."
    },
    "facts": {
      "th": [
        "เรเดียม",
        "รางวัลโนเบล 2 สาขา",
        "เคมีและฟิสิกส์"
      ],
      "en": [
        "Radium",
        "Two Nobel science prizes",
        "Chemistry and physics"
      ]
    },
    "source": {
      "url": "https://th.wikipedia.org/wiki/มารี_กูว์รี",
      "language": "th",
      "label": "Wikipedia"
    },
    "imageCredit": "LearnMatch AI template placeholder",
    "imageLicense": "template-generated"
  },
  {
    "id": "rosalind",
    "title": {
      "th": "โรซาลินด์ แฟรงคลิน",
      "en": "Rosalind Franklin"
    },
    "image": "/assets/placeholders/item-05.svg",
    "field": {
      "th": "นักผลึกวิทยาโครงสร้าง DNA",
      "en": "DNA crystallographer"
    },
    "color": "#ffcf70",
    "description": {
      "th": "นักเคมีและนักผลึกวิทยาชาวอังกฤษ เจ้าของภาพ Photo 51 ซึ่งเผยให้เห็นโครงสร้างเกลียวคู่ของ DNA และมีบทบาทสำคัญต่อความเข้าใจรหัสชีวิต",
      "en": "An English chemist and crystallographer whose Photo 51 provided important evidence for DNA's double-helix structure."
    },
    "facts": {
      "th": [
        "Photo 51",
        "DNA",
        "ผลึกวิทยาเอกซเรย์"
      ],
      "en": [
        "Photo 51",
        "DNA",
        "X-ray crystallography"
      ]
    },
    "source": {
      "url": "https://th.wikipedia.org/wiki/โรซาลินด์_แฟรงคลิน",
      "language": "th",
      "label": "Wikipedia"
    },
    "imageCredit": "LearnMatch AI template placeholder",
    "imageLicense": "template-generated"
  },
  {
    "id": "grace",
    "title": {
      "th": "เกรซ ฮอปเปอร์",
      "en": "Grace Hopper"
    },
    "image": "/assets/placeholders/item-06.svg",
    "field": {
      "th": "ผู้สร้างคอมไพเลอร์และ COBOL",
      "en": "Compiler and COBOL creator"
    },
    "color": "#ff83c5",
    "description": {
      "th": "พลเรือตรีและนักคอมพิวเตอร์ผู้บุกเบิกคอมไพเลอร์ A‑0 และวางรากฐานภาษา COBOL ทำให้คอมพิวเตอร์ทำงานกับภาษาที่มนุษย์อ่านเข้าใจได้มากขึ้น",
      "en": "A computer scientist and rear admiral who pioneered the A-0 compiler and helped lay the foundations for COBOL."
    },
    "facts": {
      "th": [
        "คอมไพเลอร์",
        "COBOL",
        "debug"
      ],
      "en": [
        "Compiler",
        "COBOL",
        "Debugging"
      ]
    },
    "source": {
      "url": "https://th.wikipedia.org/wiki/เกรซ_ฮอปเปอร์",
      "language": "th",
      "label": "Wikipedia"
    },
    "imageCredit": "LearnMatch AI template placeholder",
    "imageLicense": "template-generated"
  },
  {
    "id": "chien",
    "title": {
      "th": "อู๋ เจี้ยนสยง",
      "en": "Chien-Shiung Wu"
    },
    "image": "/assets/placeholders/item-07.svg",
    "field": {
      "th": "นักฟิสิกส์ผู้พิสูจน์การละเมิดพาริตี",
      "en": "Parity-violation physicist"
    },
    "color": "#9ba8ff",
    "description": {
      "th": "นักฟิสิกส์ชาวจีน–อเมริกัน ผู้พิสูจน์จากการทดลองโคบอลต์‑60 ว่าธรรมชาติไม่รักษาความสมมาตรซ้าย–ขวา จนได้รับการยกย่องเป็น First Lady of Physics",
      "en": "A Chinese-American physicist whose cobalt-60 experiment demonstrated that nature does not preserve left-right symmetry in the relevant weak interaction."
    },
    "facts": {
      "th": [
        "โคบอลต์‑60",
        "Parity violation",
        "First Lady of Physics"
      ],
      "en": [
        "Cobalt-60",
        "Parity violation",
        "First Lady of Physics"
      ]
    },
    "source": {
      "url": "https://en.wikipedia.org/wiki/Chien-Shiung_Wu",
      "language": "en",
      "label": "Wikipedia"
    },
    "imageCredit": "LearnMatch AI template placeholder",
    "imageLicense": "template-generated"
  },
  {
    "id": "tu",
    "title": {
      "th": "ตู โยวโยว",
      "en": "Tu Youyou"
    },
    "image": "/assets/placeholders/item-08.svg",
    "field": {
      "th": "ผู้ค้นพบยาต้านมาลาเรีย",
      "en": "Antimalarial medicine pioneer"
    },
    "color": "#74e6ad",
    "description": {
      "th": "นักเคมีเภสัชชาวจีน ผู้ค้นพบวิธีสกัดสารอาร์เทมิซินินจากตำรายาจีนโบราณ ช่วยชีวิตผู้คนจากโรคมาลาเรียทั่วโลก และได้รับรางวัลโนเบลในปี 2015",
      "en": "A Chinese pharmaceutical chemist who helped discover artemisinin, an antimalarial treatment, and received the 2015 Nobel Prize in Physiology or Medicine."
    },
    "facts": {
      "th": [
        "อาร์เทมิซินิน",
        "มาลาเรีย",
        "โนเบลการแพทย์"
      ],
      "en": [
        "Artemisinin",
        "Malaria",
        "Nobel Prize in Medicine"
      ]
    },
    "source": {
      "url": "https://th.wikipedia.org/wiki/ถู_โยวโยว",
      "language": "th",
      "label": "Wikipedia"
    },
    "imageCredit": "LearnMatch AI template placeholder",
    "imageLicense": "template-generated"
  },
  {
    "id": "valentina",
    "title": {
      "th": "วาเลนตินา เทเรชโควา",
      "en": "Valentina Tereshkova"
    },
    "image": "/assets/placeholders/item-09.svg",
    "field": {
      "th": "ผู้หญิงคนแรกในอวกาศ",
      "en": "First woman in space"
    },
    "color": "#7cc8ff",
    "description": {
      "th": "นักบินอวกาศชาวโซเวียต ผู้เดินทางสู่อวกาศด้วยยาน Vostok 6 ในปี 1963 และโคจรรอบโลก 48 รอบในภารกิจเดี่ยวที่สร้างประวัติศาสตร์",
      "en": "A Soviet cosmonaut who flew Vostok 6 in 1963 and became the first woman in space, completing 48 Earth orbits on a solo mission."
    },
    "facts": {
      "th": [
        "Vostok 6",
        "48 รอบโลก",
        "ภารกิจเดี่ยว"
      ],
      "en": [
        "Vostok 6",
        "48 Earth orbits",
        "Solo mission"
      ]
    },
    "source": {
      "url": "https://th.wikipedia.org/wiki/วาเลนตีนา_เตเรชโควา",
      "language": "th",
      "label": "Wikipedia"
    },
    "imageCredit": "LearnMatch AI template placeholder",
    "imageLicense": "template-generated"
  },
  {
    "id": "mae",
    "title": {
      "th": "เม แจมิสัน",
      "en": "Mae Jemison"
    },
    "image": "/assets/placeholders/item-10.svg",
    "field": {
      "th": "นักบินอวกาศหญิงผิวสีคนแรก",
      "en": "First Black woman in space"
    },
    "color": "#ff9a83",
    "description": {
      "th": "แพทย์และวิศวกรชาวอเมริกัน ผู้เป็นสตรีผิวสีคนแรกที่เดินทางสู่อวกาศกับกระสวย Endeavour ในปี 1992 และเป็นแรงบันดาลใจให้เด็กทั่วโลก",